{
  "$schema": "https://json-schema.org/draft/2020-12/schema",
  "$id": "https://aicte.gov.in/schemas/v4/document_ingest_response.schema.json",
  "title": "Document Ingestion Response",
  "description": "Response emitted by POST /applications/{id}/documents upon successful upload streaming, vault storage, and database persistence (Guide §4 S1).",
  "type": "object",
  "required": [
    "application_id",
    "document_id",
    "detected_kind",
    "detected_media_type",
    "byte_size",
    "blake3",
    "sha256",
    "storage_key",
    "processing_state",
    "pipeline_stage",
    "ocr_status",
    "persistence_status",
    "is_new_blob",
    "idempotent_replay",
    "simulated",
    "advisory",
    "created_at",
    "message"
  ],
  "properties": {
    "application_id": {
      "type": "string",
      "description": "Identifier of the target application"
    },
    "document_id": {
      "type": "string",
      "description": "Generated unique document identifier"
    },
    "doc_slot": {
      "type": ["string", "null"],
      "description": "Assigned document slot (e.g. fire_noc, affidavit)"
    },
    "detected_kind": {
      "type": "string",
      "enum": ["pdf", "png", "jpeg"],
      "description": "Document format identified strictly by magic bytes"
    },
    "detected_media_type": {
      "type": "string",
      "enum": ["application/pdf", "image/png", "image/jpeg"]
    },
    "byte_size": {
      "type": "integer",
      "minimum": 1,
      "description": "Exact payload size in bytes"
    },
    "blake3": {
      "type": "string",
      "pattern": "^[0-9a-f]{64}$",
      "description": "BLAKE3 cryptographic digest computed during upload streaming"
    },
    "sha256": {
      "type": "string",
      "pattern": "^[0-9a-f]{64}$",
      "description": "SHA-256 cryptographic digest computed during upload streaming"
    },
    "storage_key": {
      "type": "string",
      "description": "Content-addressed key in vault storage (e.g. b3/<aa>/<bb>/<blake3>)"
    },
    "processing_state": {
      "type": "string",
      "enum": ["PERSISTED", "INGESTED_STREAM_VERIFIED"],
      "description": "Current processing state in ingestion gateway"
    },
    "pipeline_stage": {
      "type": "string",
      "const": "S1_INGESTION_GATEWAY"
    },
    "ocr_status": {
      "type": "string",
      "const": "NOT_RUN",
      "description": "OCR is not run during raw ingestion"
    },
    "persistence_status": {
      "type": "string",
      "enum": ["VAULT_LOCAL", "EPHEMERAL_SCRATCH_VERIFIED"],
      "description": "Storage status: persisted in local content-addressed vault"
    },
    "is_new_blob": {
      "type": "boolean",
      "description": "True if blob was newly added; False if deduplicated against existing vault object"
    },
    "idempotent_replay": {
      "type": "boolean",
      "description": "True if request was an idempotent replay with same idempotency key and content"
    },
    "simulated": {
      "type": "boolean",
      "const": true
    },
    "advisory": {
      "type": "boolean",
      "const": true
    },
    "created_at": {
      "type": "string",
      "description": "ISO 8601 UTC creation timestamp"
    },
    "message": {
      "type": "string"
    }
  }
}
